{"$schemaId":"https://schemas.cp6.dev/release/platform-release-candidate.v1","buildProvenance":{"byteLength":1,"key":"objects/sha256/aa/aaaaaaaaaaaaaaaaaaaaaaaaaaaaaaaaaaaaaaaaaaaaaaaaaaaaaaaaaaaaaaaa/build-invocation-provenance.v1.json","mediaType":"application/vnd.cp6.build-invocation-provenance.v1+json","sha256":"aaaaaaaaaaaaaaaaaaaaaaaaaaaaaaaaaaaaaaaaaaaaaaaaaaaaaaaaaaaaaaaa","storageAuthority":"cp6-release-r2-v1"},"candidateKind":"PlatformReference","createdAtUtc":"2026-09-01T00:00:00.000Z","crmConsumer":{"commitSha":"bbbbbbbbbbbbbbbbbbbbbbbbbbbbbbbbbbbbbbbb","environment":"test","repository":"GTX537/CP6.CRM","runAttempt":1,"runId":1,"workflowFileSha":"bbbbbbbbbbbbbbbbbbbbbbbbbbbbbbbbbbbbbbbb","workflowPath":".github/workflows/platform-consumer.yml"},"deployable":false,"evidence":[{"byteLength":1,"key":"objects/sha256/aa/aaaaaaaaaaaaaaaaaaaaaaaaaaaaaaaaaaaaaaaaaaaaaaaaaaaaaaaaaaaaaaaa/evidence-record.v1.json","mediaType":"application/vnd.cp6.evidence-record.v1+json","sha256":"aaaaaaaaaaaaaaaaaaaaaaaaaaaaaaaaaaaaaaaaaaaaaaaaaaaaaaaaaaaaaaaa","storageAuthority":"cp6-release-r2-v1"}],"images":[],"packages":[{"authorSignedPackageSha256":"aaaaaaaaaaaaaaaaaaaaaaaaaaaaaaaaaaaaaaaaaaaaaaaaaaaaaaaaaaaaaaaa","feedIdentity":"test-only","feedTransformation":"None","packageId":"CP6.Platform.Abstractions","publishedPackageSha256":"aaaaaaaaaaaaaaaaaaaaaaaaaaaaaaaaaaaaaaaaaaaaaaaaaaaaaaaaaaaaaaaa","signerFingerprint":"aaaaaaaaaaaaaaaaaaaaaaaaaaaaaaaaaaaaaaaaaaaaaaaaaaaaaaaaaaaaaaaa","sourceGitSha":"bbbbbbbbbbbbbbbbbbbbbbbbbbbbbbbbbbbbbbbb","timestampPolicy":"TestOnlyNone","version":"0.10.0-test.bbbbbbbbbbbb.1"},{"authorSignedPackageSha256":"aaaaaaaaaaaaaaaaaaaaaaaaaaaaaaaaaaaaaaaaaaaaaaaaaaaaaaaaaaaaaaaa","feedIdentity":"test-only","feedTransformation":"None","packageId":"CP6.Platform.AspNetCore","publishedPackageSha256":"aaaaaaaaaaaaaaaaaaaaaaaaaaaaaaaaaaaaaaaaaaaaaaaaaaaaaaaaaaaaaaaa","signerFingerprint":"aaaaaaaaaaaaaaaaaaaaaaaaaaaaaaaaaaaaaaaaaaaaaaaaaaaaaaaaaaaaaaaa","sourceGitSha":"bbbbbbbbbbbbbbbbbbbbbbbbbbbbbbbbbbbbbbbb","timestampPolicy":"TestOnlyNone","version":"0.10.0-test.bbbbbbbbbbbb.1"},{"authorSignedPackageSha256":"aaaaaaaaaaaaaaaaaaaaaaaaaaaaaaaaaaaaaaaaaaaaaaaaaaaaaaaaaaaaaaaa","feedIdentity":"test-only","feedTransformation":"None","packageId":"CP6.Platform.Contracts","publishedPackageSha256":"aaaaaaaaaaaaaaaaaaaaaaaaaaaaaaaaaaaaaaaaaaaaaaaaaaaaaaaaaaaaaaaa","signerFingerprint":"aaaaaaaaaaaaaaaaaaaaaaaaaaaaaaaaaaaaaaaaaaaaaaaaaaaaaaaaaaaaaaaa","sourceGitSha":"bbbbbbbbbbbbbbbbbbbbbbbbbbbbbbbbbbbbbbbb","timestampPolicy":"TestOnlyNone","version":"0.10.0-test.bbbbbbbbbbbb.1"},{"authorSignedPackageSha256":"aaaaaaaaaaaaaaaaaaaaaaaaaaaaaaaaaaaaaaaaaaaaaaaaaaaaaaaaaaaaaaaa","feedIdentity":"test-only","feedTransformation":"None","packageId":"CP6.Platform.Deployment","publishedPackageSha256":"aaaaaaaaaaaaaaaaaaaaaaaaaaaaaaaaaaaaaaaaaaaaaaaaaaaaaaaaaaaaaaaa","signerFingerprint":"aaaaaaaaaaaaaaaaaaaaaaaaaaaaaaaaaaaaaaaaaaaaaaaaaaaaaaaaaaaaaaaa","sourceGitSha":"bbbbbbbbbbbbbbbbbbbbbbbbbbbbbbbbbbbbbbbb","timestampPolicy":"TestOnlyNone","version":"0.10.0-test.bbbbbbbbbbbb.1"},{"authorSignedPackageSha256":"aaaaaaaaaaaaaaaaaaaaaaaaaaaaaaaaaaaaaaaaaaaaaaaaaaaaaaaaaaaaaaaa","feedIdentity":"test-only","feedTransformation":"None","packageId":"CP6.Platform.EntityFramework","publishedPackageSha256":"aaaaaaaaaaaaaaaaaaaaaaaaaaaaaaaaaaaaaaaaaaaaaaaaaaaaaaaaaaaaaaaa","signerFingerprint":"aaaaaaaaaaaaaaaaaaaaaaaaaaaaaaaaaaaaaaaaaaaaaaaaaaaaaaaaaaaaaaaa","sourceGitSha":"bbbbbbbbbbbbbbbbbbbbbbbbbbbbbbbbbbbbbbbb","timestampPolicy":"TestOnlyNone","version":"0.10.0-test.bbbbbbbbbbbb.1"},{"authorSignedPackageSha256":"aaaaaaaaaaaaaaaaaaaaaaaaaaaaaaaaaaaaaaaaaaaaaaaaaaaaaaaaaaaaaaaa","feedIdentity":"test-only","feedTransformation":"None","packageId":"CP6.Platform.Messaging","publishedPackageSha256":"aaaaaaaaaaaaaaaaaaaaaaaaaaaaaaaaaaaaaaaaaaaaaaaaaaaaaaaaaaaaaaaa","signerFingerprint":"aaaaaaaaaaaaaaaaaaaaaaaaaaaaaaaaaaaaaaaaaaaaaaaaaaaaaaaaaaaaaaaa","sourceGitSha":"bbbbbbbbbbbbbbbbbbbbbbbbbbbbbbbbbbbbbbbb","timestampPolicy":"TestOnlyNone","version":"0.10.0-test.bbbbbbbbbbbb.1"},{"authorSignedPackageSha256":"aaaaaaaaaaaaaaaaaaaaaaaaaaaaaaaaaaaaaaaaaaaaaaaaaaaaaaaaaaaaaaaa","feedIdentity":"test-only","feedTransformation":"None","packageId":"CP6.Platform.Release","publishedPackageSha256":"aaaaaaaaaaaaaaaaaaaaaaaaaaaaaaaaaaaaaaaaaaaaaaaaaaaaaaaaaaaaaaaa","signerFingerprint":"aaaaaaaaaaaaaaaaaaaaaaaaaaaaaaaaaaaaaaaaaaaaaaaaaaaaaaaaaaaaaaaa","sourceGitSha":"bbbbbbbbbbbbbbbbbbbbbbbbbbbbbbbbbbbbbbbb","timestampPolicy":"TestOnlyNone","version":"0.10.0-test.bbbbbbbbbbbb.1"}],"platformSource":{"sha256OrDigest":"aaaaaaaaaaaaaaaaaaaaaaaaaaaaaaaaaaaaaaaaaaaaaaaaaaaaaaaaaaaaaaaa","sourceGitSha":"bbbbbbbbbbbbbbbbbbbbbbbbbbbbbbbbbbbbbbbb","subjectKind":"RepositoryCommit","subjectName":"CP6.Platform"},"policyVersions":{"evidence":1,"trust":1},"publisher":{"commitSha":"bbbbbbbbbbbbbbbbbbbbbbbbbbbbbbbbbbbbbbbb","environment":"test","repository":"GTX537/CP6.Platform","runAttempt":1,"runId":1,"workflowFileSha":"bbbbbbbbbbbbbbbbbbbbbbbbbbbbbbbbbbbbbbbb","workflowPath":".github/workflows/publish.yml"},"releaseGateResult":{"byteLength":1,"key":"objects/sha256/aa/aaaaaaaaaaaaaaaaaaaaaaaaaaaaaaaaaaaaaaaaaaaaaaaaaaaaaaaaaaaaaaaa/release-gate-result.v1.json","mediaType":"application/vnd.cp6.release-gate-result.v1+json","sha256":"aaaaaaaaaaaaaaaaaaaaaaaaaaaaaaaaaaaaaaaaaaaaaaaaaaaaaaaaaaaaaaaa","storageAuthority":"cp6-release-r2-v1"},"verifier":{"commitSha":"bbbbbbbbbbbbbbbbbbbbbbbbbbbbbbbbbbbbbbbb","environment":"test","repository":"GTX537/CP6.Platform","runAttempt":1,"runId":1,"workflowFileSha":"bbbbbbbbbbbbbbbbbbbbbbbbbbbbbbbbbbbbbbbb","workflowPath":".github/workflows/verify.yml"}}